{
  "artifacts": {
    "factsheet_check": {
      "checks": [
        {
          "evidence": {
            "source": "factsheet_text",
            "value": "Generic Education Issuer."
          },
          "field": "issuer",
          "label": "Issuer",
          "message": "Issuer mentioned in factsheet text.",
          "status": "pass"
        },
        {
          "evidence": {
            "source": "factsheet_text",
            "value": "Example Exchange."
          },
          "field": "exchange",
          "label": "Exchange",
          "message": "Exchange mentioned in factsheet text.",
          "status": "pass"
        },
        {
          "evidence": {
            "source": "product_json",
            "value": "Nasdaq-100 reference index"
          },
          "field": "underlying",
          "label": "Underlying",
          "message": "Underlying found in product JSON.",
          "status": "pass"
        },
        {
          "evidence": {
            "source": "product_json",
            "value": 3
          },
          "field": "leverage_factor",
          "label": "Leverage factor",
          "message": "Leverage factor found in product JSON.",
          "status": "pass"
        },
        {
          "evidence": {
            "source": "product_json",
            "value": "reset_frequency=daily"
          },
          "field": "daily_reset",
          "label": "Daily reset wording",
          "message": "Product reset frequency is daily.",
          "status": "pass"
        },
        {
          "evidence": {
            "source": "product_json",
            "value": 0.0095
          },
          "field": "fee",
          "label": "Fee",
          "message": "Fee found in product JSON.",
          "status": "pass"
        },
        {
          "evidence": {
            "source": "product_json",
            "value": "USD"
          },
          "field": "currency",
          "label": "Currency",
          "message": "Currency found in product JSON.",
          "status": "pass"
        },
        {
          "evidence": {
            "source": "factsheet_text",
            "value": "placeholder: verify current liquidity and bid-ask spread before use"
          },
          "field": "liquidity_spread",
          "label": "Liquidity/spread placeholder",
          "message": "Factsheet text includes liquidity or spread language, but no live market data is fetched.",
          "status": "review"
        },
        {
          "evidence": {
            "source": "factsheet_text",
            "value": "review the public intraday indicative value field or ticker before use."
          },
          "field": "inav",
          "label": "iNAV field",
          "message": "iNAV field mentioned in factsheet text.",
          "status": "pass"
        },
        {
          "evidence": {
            "source": "factsheet_text",
            "value": "review issuer premium/discount history before use."
          },
          "field": "premium_discount",
          "label": "Premium/discount field",
          "message": "Premium/discount field mentioned in factsheet text.",
          "status": "pass"
        }
      ],
      "document_type": "factsheet_check",
      "inputs": {
        "factsheet_file": "examples/fixtures/factsheet_note.txt",
        "product": "examples/fixtures/leveraged_nasdaq_3x.json"
      },
      "missing_fields": [],
      "not_investment_advice": "This factsheet checklist is for educational product-term review only. It is not investment advice, a recommendation, or a suitability determination.",
      "product": {
        "name": "Generic 3x Nasdaq Daily Reset ETP",
        "ticker": "NDAQ3X"
      },
      "provenance": {
        "command": "factsheet-check",
        "factsheet_file": "examples/fixtures/factsheet_note.txt",
        "product": "examples/fixtures/leveraged_nasdaq_3x.json"
      },
      "schema_version": "0.15",
      "summary": {
        "checks": 10,
        "missing": 0,
        "passed": 9,
        "ready_for_review": true,
        "review": 1
      }
    },
    "position_size": {
      "checklist": [
        "Confirm account value and loss budget before using the notional figure.",
        "Convert notional to shares with the intended execution price outside this model.",
        "Check liquidity, spreads, trading halts, and gap risk before relying on a stop.",
        "Compare exposure multiple with portfolio concentration and leverage limits.",
        "Record that this output is for scenario planning and is not investment advice."
      ],
      "document_type": "position_size_plan",
      "inputs": {
        "account_value": 50000.0,
        "currency": "USD",
        "loss_basis": "stop_loss",
        "max_loss_budget": 750.0,
        "risk_budget_pct": 1.5,
        "stop_loss_pct": 15.0
      },
      "not_investment_advice": "This position sizing planner is for scenario planning and education only. It is not investment advice, a recommendation, or a suitability determination.",
      "product": {
        "annual_fee_pct": 0.95,
        "currency": "USD",
        "leverage": 3.0,
        "name": "Generic 3x Nasdaq Daily Reset ETP",
        "reset_frequency": "daily",
        "ticker": "NDAQ3X",
        "underlying": "Nasdaq-100 reference index"
      },
      "provenance": {
        "account_value": 50000.0,
        "command": "recipe-run:position-size",
        "max_loss_budget": null,
        "recipe": "examples/fixtures/recipe_thesis_review.json",
        "risk_budget_pct": 0.015,
        "source": "recipe_pretrade_plan",
        "stop_loss": 0.15
      },
      "recommendation": {
        "exposure_multiple": 0.3,
        "max_shares": null,
        "max_shares_placeholder": "Divide recommended_notional by the intended execution price; no live price is modeled.",
        "modeled_loss_at_stop": 750.0,
        "modeled_loss_pct_of_account": 1.5,
        "recommended_notional": 5000.0
      },
      "scenario": {
        "days": 6,
        "ending_etp_nav": 100.608795,
        "etp_return_pct": 0.6088,
        "path_decay_vs_simple_multiple": -0.602755,
        "underlying_return_pct": 0.4038
      },
      "schema_version": "0.8",
      "warnings": [
        "Daily reset leverage means multi-day returns can differ materially from the underlying return times leverage.",
        "Scenario output is not investment advice and does not predict future returns.",
        "Large daily moves can compound quickly and may create losses larger than a simple one-day estimate.",
        "Fee drag is approximated as a constant daily deduction from the leveraged daily return.",
        "A pretrade plan does not confirm liquidity, execution quality, tax treatment, or suitability.",
        "Stop-loss and take-profit bands are planning levels, not guaranteed execution prices.",
        "Recommended notional is a deterministic planning output, not a trade recommendation.",
        "Share count is a placeholder because no live or execution price is modeled.",
        "Stop-loss levels are planning inputs and do not guarantee execution at the modeled loss."
      ]
    },
    "pretrade_plan": {
      "assumptions": [
        "Scenario path is deterministic fixture data, not a forecast.",
        "Modeled NAV starts at 100 and applies daily reset leverage once per scenario row.",
        "Fees are approximated as a constant daily deduction from leveraged daily return.",
        "Risk bands are evaluated on modeled end-of-day NAV values.",
        "The maximum loss budget is supplied by the user and is not a sizing recommendation."
      ],
      "budget": {
        "currency": "USD",
        "max_loss_budget": 750.0
      },
      "checklist": {
        "items": [
          "Confirm the product uses daily reset leverage and identify the stated leverage factor.",
          "Compare the planned holding period with the product objective and risk disclosures.",
          "Run at least one trending path and one choppy path before sizing the trade.",
          "Record stop-loss and take-profit levels before entry.",
          "Review borrowing, financing, and management-fee drag assumptions.",
          "Check whether the underlying has event risk, earnings, regulatory decisions, or macro releases.",
          "Document why the scenario does not rely on a simple leverage multiple over several days.",
          "Record maximum tolerable loss, concentration, and portfolio correlation."
        ],
        "profile": "risk-review"
      },
      "document_type": "pretrade_plan",
      "not_investment_advice": "This decision packet is for scenario planning and education only. It is not investment advice, a recommendation, or a suitability determination.",
      "product": {
        "annual_fee_pct": 0.95,
        "currency": "USD",
        "leverage": 3.0,
        "name": "Generic 3x Nasdaq Daily Reset ETP",
        "reset_frequency": "daily",
        "ticker": "NDAQ3X",
        "underlying": "Nasdaq-100 reference index"
      },
      "provenance": {
        "checklist_profile": "risk-review",
        "command": "recipe-run:pretrade-plan",
        "initial_nav": 100.0,
        "max_loss_budget": 750.0,
        "path": "examples/fixtures/nasdaq_chop_path.csv",
        "product": "examples/fixtures/leveraged_nasdaq_3x.json",
        "stop_loss": 0.15,
        "take_profit": 0.2,
        "thesis_file": "examples/fixtures/thesis_note.md"
      },
      "risk_bands": {
        "band_events": [],
        "stop_loss_pct": 15.0,
        "take_profit_pct": 20.0
      },
      "scenario": {
        "days": 6,
        "ending_etp_nav": 100.608795,
        "etp_return_pct": 0.6088,
        "path_decay_vs_simple_multiple": -0.602755,
        "underlying_return_pct": 0.4038
      },
      "schema_version": "0.3",